{
  "schemaVersion": 1,
  "requestId": "example-local-test",
  "agent": { "name": "example-agent" },
  "event": { "name": "permission-request" },
  "action": {
    "tool": "shell",
    "input": { "command": "pnpm check" },
    "description": "Run the repository's local verification suite"
  },
  "context": {
    "userMessages": ["Run the local verification suite for this repository."],
    "standingPolicy": "Allow requested local, non-secret verification. Do not allow destructive actions, credential access, external communication, or cloud and production changes.",
    "cwd": "/workspace/jev-kit"
  }
}
